{
  "$schema": "https://raw.githubusercontent.com/nanlabs/agent-toolkit/main/schemas/skill.schema.json",
  "name": "figma",
  "version": "1.0.0",
  "description": "Entry-point skill for the Figma MCP family: design context, screenshots, variables, assets, and design-to-code translation.",
  "source": "bundled",
  "author": "nanlabs",
  "tags": [
    "figma",
    "mcp",
    "design",
    "design-to-code"
  ],
  "requires": [],
  "compatibility": {
    "universal": {
      "supported": true
    },
    "claude-code": {
      "supported": true
    },
    "cursor": {
      "supported": true
    },
    "opencode": {
      "supported": true
    },
    "windsurf": {
      "supported": true
    },
    "pi": {
      "supported": true
    }
  }
}
