{
  "$schema": "https://raw.githubusercontent.com/nanlabs/agent-toolkit/main/schemas/skill.schema.json",
  "name": "figma-implement-design",
  "version": "1.0.0",
  "description": "Translates Figma designs into production-ready application code with 1:1 visual fidelity using the Figma MCP server.",
  "source": "bundled",
  "author": "nanlabs",
  "tags": [
    "figma",
    "mcp",
    "design-to-code",
    "ui"
  ],
  "requires": [],
  "compatibility": {
    "universal": {
      "supported": true
    },
    "claude-code": {
      "supported": true
    },
    "cursor": {
      "supported": true
    },
    "opencode": {
      "supported": true
    },
    "windsurf": {
      "supported": true
    },
    "pi": {
      "supported": true
    }
  }
}
