{
  "$schema": "https://raw.githubusercontent.com/nanlabs/agent-toolkit/main/schemas/skill.schema.json",
  "name": "linear",
  "version": "1.0.0",
  "description": "Manage Linear issues, projects and cycles through the Linear MCP server.",
  "source": "bundled",
  "author": "nanlabs",
  "tags": [
    "linear",
    "mcp",
    "task-management",
    "sprint-planning"
  ],
  "requires": [],
  "compatibility": {
    "universal": {
      "supported": true
    },
    "claude-code": {
      "supported": true
    },
    "cursor": {
      "supported": true
    },
    "opencode": {
      "supported": true
    },
    "windsurf": {
      "supported": true,
      "notes": "On Windows native, run the MCP via WSL \u2014 see SKILL.md."
    },
    "pi": {
      "supported": true
    }
  }
}
