{
  "$schema": "https://raw.githubusercontent.com/nanlabs/agent-toolkit/main/schemas/skill.schema.json",
  "name": "nanlabs-management-unit-assessment",
  "version": "1.0.0",
  "description": "WHAT: Evidence-based management unit assessment for governance, delivery, collaboration, culture, and AI-native management readiness indicators.",
  "source": "bundled",
  "author": "nanlabs",
  "tags": [
    "nanlabs",
    "management-assessment",
    "project-assessment",
    "quality-indicators",
    "governance",
    "delivery"
  ],
  "compatibility": {
    "universal": {
      "supported": true
    },
    "claude-code": {
      "supported": true
    },
    "pi": {
      "supported": true
    },
    "windsurf": {
      "supported": true
    }
  }
}
