{
  "$schema": "https://raw.githubusercontent.com/nanlabs/agent-toolkit/main/schemas/skill.schema.json",
  "name": "nanlabs-project-assessment",
  "version": "1.0.0",
  "description": "WHAT: Interactive project assessment router for evidence-based management and technical unit assessments, scorecards, findings, and action plans.",
  "source": "bundled",
  "author": "nanlabs",
  "tags": [
    "nanlabs",
    "project-assessment",
    "assessment",
    "quality-indicators",
    "audit",
    "evidence"
  ],
  "compatibility": {
    "universal": {
      "supported": true
    },
    "claude-code": {
      "supported": true
    },
    "pi": {
      "supported": true
    },
    "windsurf": {
      "supported": true
    }
  }
}
