{
  "$schema": "https://raw.githubusercontent.com/nanlabs/agent-toolkit/main/schemas/skill.schema.json",
  "name": "nanlabs-task",
  "version": "1.0.0",
  "description": "WHAT: Draft and review technical tasks using the NaNLABS Best Practices Task Template; includes summary, technical notes, AC, estimate, owner, and due date.",
  "source": "bundled",
  "author": "nanlabs",
  "tags": [
    "nanlabs",
    "task",
    "work-item",
    "technical-task",
    "clickup"
  ],
  "compatibility": {
    "universal": {
      "supported": true
    },
    "claude-code": {
      "supported": true
    },
    "pi": {
      "supported": true
    },
    "windsurf": {
      "supported": true
    }
  }
}
