{
  "$schema": "https://raw.githubusercontent.com/nanlabs/agent-toolkit/main/schemas/skill.schema.json",
  "name": "nanlabs-work-item",
  "version": "1.0.0",
  "description": "WHAT: Router for creating and refining epics, user stories, tasks, bugs, and incidents using NaNLABS Best Practices work item hierarchy.",
  "source": "bundled",
  "author": "nanlabs",
  "tags": [
    "nanlabs",
    "work-items",
    "epic",
    "story",
    "task",
    "bug",
    "clickup"
  ],
  "compatibility": {
    "universal": {
      "supported": true
    },
    "claude-code": {
      "supported": true
    },
    "pi": {
      "supported": true
    },
    "windsurf": {
      "supported": true
    }
  }
}
