{
  "$schema": "https://raw.githubusercontent.com/nanlabs/agent-toolkit/main/schemas/skill.schema.json",
  "name": "jupyter-notebook",
  "version": "1.0.0",
  "description": "Scaffold and refactor reproducible Jupyter notebooks for experiments and tutorials using bundled templates and the new_notebook.py helper.",
  "source": "bundled",
  "author": "nanlabs",
  "tags": [
    "jupyter",
    "notebook",
    "data-science",
    "rd"
  ],
  "requires": [
    "python3"
  ],
  "compatibility": {
    "universal": {
      "supported": true
    },
    "claude-code": {
      "supported": true
    },
    "cursor": {
      "supported": true
    },
    "opencode": {
      "supported": true
    },
    "windsurf": {
      "supported": true
    },
    "pi": {
      "supported": true
    }
  }
}
