{
  "$schema": "https://raw.githubusercontent.com/nanlabs/agent-toolkit/main/schemas/skill.schema.json",
  "name": "nanlabs-development-workflow",
  "version": "1.0.0",
  "description": "WHAT: Default development workflow, task lifecycle, DoR, DoD, validation, and evidence model when a project has no explicit override.",
  "source": "bundled",
  "author": "nanlabs",
  "tags": [
    "nanlabs",
    "development-workflow",
    "validation",
    "definition-of-ready",
    "definition-of-done",
    "delivery"
  ],
  "compatibility": {
    "universal": {
      "supported": true
    },
    "claude-code": {
      "supported": true
    },
    "pi": {
      "supported": true
    },
    "windsurf": {
      "supported": true
    }
  }
}
