{
  "$schema": "https://raw.githubusercontent.com/nanlabs/agent-toolkit/main/schemas/skill.schema.json",
  "name": "nanlabs-assistant",
  "version": "2.1.3",
  "description": "NaNLABS Assistant: inspect any repo in order README\u2192docs\u2192AGENTS\u2192CONTRIBUTING\u2192PR templates\u2192Make/just/npm\u2192devcontainer\u2192CI\u2192configs\u2192code; route delivery artifacts and project assessments to atomic skills; cite sources; AGENTS.md wins for agent behavior; suggest consolidation for portable rules; nan-* when on NaNLABS baseline.",
  "source": "bundled",
  "author": "nanlabs",
  "tags": [
    "nanlabs",
    "assistant",
    "companion",
    "workflow",
    "client-work",
    "readme",
    "docs",
    "agents-md",
    "contributing",
    "ci",
    "devcontainer",
    "chezmoi",
    "workstation",
    "skills",
    "portability",
    "best-practices"
  ],
  "compatibility": {
    "universal": {
      "supported": true
    },
    "claude-code": {
      "supported": true
    },
    "pi": {
      "supported": true
    },
    "windsurf": {
      "supported": true
    }
  }
}
