{
  "$schema": "https://raw.githubusercontent.com/nanlabs/agent-toolkit/main/schemas/skill.schema.json",
  "name": "nanlabs-trd",
  "version": "1.0.0",
  "description": "WHAT: Draft and review a TRD from the NaNLABS ClickUp template, aligned to PRD and ADRs; delegates discovery to nanlabs-assistant and tickets to clickup-cli.",
  "source": "bundled",
  "author": "nanlabs",
  "tags": [
    "nanlabs",
    "trd",
    "technical-requirements",
    "architecture",
    "clickup",
    "delivery"
  ],
  "compatibility": {
    "universal": {
      "supported": true
    },
    "claude-code": {
      "supported": true
    },
    "pi": {
      "supported": true
    },
    "windsurf": {
      "supported": true
    }
  }
}
