{
  "$schema": "https://raw.githubusercontent.com/nanlabs/agent-toolkit/main/schemas/skill.schema.json",
  "name": "nanlabs-adr",
  "version": "1.0.0",
  "description": "WHAT: Architecture Decision Records per the NaNLABS ADR workflow in ClickUp: when to write, structure, review, and traceability; delegates forge steps to GitHub/GitLab skills.",
  "source": "bundled",
  "author": "nanlabs",
  "tags": [
    "nanlabs",
    "adr",
    "architecture",
    "decisions",
    "clickup",
    "governance"
  ],
  "compatibility": {
    "universal": {
      "supported": true
    },
    "claude-code": {
      "supported": true
    },
    "pi": {
      "supported": true
    },
    "windsurf": {
      "supported": true
    }
  }
}
