{
  "$schema": "https://raw.githubusercontent.com/nanlabs/agent-toolkit/main/schemas/skill.schema.json",
  "name": "nanlabs-planning",
  "version": "1.0.0",
  "description": "WHAT: Planning, estimation, task breakdown, and iteration capacity fallback based on NaNLABS Best Practices; use before finalizing backlog scope or estimates.",
  "source": "bundled",
  "author": "nanlabs",
  "tags": [
    "nanlabs",
    "planning",
    "estimation",
    "capacity",
    "delivery",
    "clickup"
  ],
  "compatibility": {
    "universal": {
      "supported": true
    },
    "claude-code": {
      "supported": true
    },
    "pi": {
      "supported": true
    },
    "windsurf": {
      "supported": true
    }
  }
}
