{
  "$schema": "https://raw.githubusercontent.com/nanlabs/agent-toolkit/main/schemas/skill.schema.json",
  "name": "nanlabs-output-handshake",
  "version": "1.0.0",
  "description": "WHAT: Ask where the final artifact goes and confirm human review before writing PRD/TRD/ADR/PR bodies; never assume a single default location.",
  "source": "bundled",
  "author": "nanlabs",
  "tags": [
    "nanlabs",
    "governance",
    "artifacts",
    "handshake",
    "review"
  ],
  "compatibility": {
    "universal": {
      "supported": true
    },
    "claude-code": {
      "supported": true
    },
    "pi": {
      "supported": true
    },
    "windsurf": {
      "supported": true
    }
  }
}
