{
  "$schema": "https://raw.githubusercontent.com/nanlabs/agent-toolkit/main/schemas/skill.schema.json",
  "name": "figma-create-design-system-rules",
  "version": "1.0.0",
  "description": "Generates project-specific design system rules (AGENTS.md / CLAUDE.md / Cursor rules / etc.) for Figma-to-code workflows using the Figma MCP server.",
  "source": "bundled",
  "author": "nanlabs",
  "tags": [
    "figma",
    "mcp",
    "design-system",
    "agents-md"
  ],
  "requires": [],
  "compatibility": {
    "universal": {
      "supported": true
    },
    "claude-code": {
      "supported": true
    },
    "cursor": {
      "supported": true
    },
    "opencode": {
      "supported": true
    },
    "windsurf": {
      "supported": true
    },
    "pi": {
      "supported": true
    }
  }
}
