{
  "$schema": "https://raw.githubusercontent.com/nanlabs/agent-toolkit/main/schemas/skill.schema.json",
  "name": "figma-create-new-file",
  "version": "1.0.0",
  "description": "Creates a new Figma file (page setup, defaults) via the Figma MCP server before authoring components or screens.",
  "source": "bundled",
  "author": "nanlabs",
  "tags": [
    "figma",
    "mcp",
    "file-creation"
  ],
  "requires": [],
  "compatibility": {
    "universal": {
      "supported": true
    },
    "claude-code": {
      "supported": true
    },
    "cursor": {
      "supported": true
    },
    "opencode": {
      "supported": true
    },
    "windsurf": {
      "supported": true
    },
    "pi": {
      "supported": true
    }
  }
}
