{
  "$schema": "https://raw.githubusercontent.com/nanlabs/agent-toolkit/main/schemas/skill.schema.json",
  "name": "nanlabs-workflow-generic-project",
  "version": "1.0.0",
  "description": "WHAT: Generic client delivery phases, gates, English ticket traceability; delegates ClickUp, Jira, and draft PR/MR to tool skills.",
  "source": "bundled",
  "author": "nanlabs",
  "tags": [
    "nanlabs",
    "workflow",
    "client",
    "delivery",
    "generic"
  ],
  "compatibility": {
    "universal": {
      "supported": true
    },
    "claude-code": {
      "supported": true
    },
    "pi": {
      "supported": true
    },
    "windsurf": {
      "supported": true
    }
  }
}
