{
  "$schema": "https://raw.githubusercontent.com/nanlabs/agent-toolkit/main/schemas/skill.schema.json",
  "name": "nanlabs-workstation-triage",
  "version": "1.1.0",
  "description": "Workstation health triage: validate tooling, directory layout, and run nan-doctor with remediation suggestions.",
  "source": "bundled",
  "author": "nanlabs",
  "tags": [
    "workstation",
    "health",
    "triage",
    "devops"
  ],
  "requires": [
    "nan-doctor"
  ],
  "compatibility": {
    "universal": {
      "supported": true
    },
    "claude-code": {
      "supported": true
    },
    "pi": {
      "supported": true
    },
    "windsurf": {
      "supported": true
    }
  }
}
