{
  "$schema": "https://raw.githubusercontent.com/nanlabs/agent-toolkit/main/schemas/skill.schema.json",
  "name": "nanlabs-user-story",
  "version": "1.0.0",
  "description": "WHAT: Draft and review user stories using the NaNLABS task template plus the As a/I want/so that format from Best Practices examples.",
  "source": "bundled",
  "author": "nanlabs",
  "tags": [
    "nanlabs",
    "user-story",
    "work-item",
    "acceptance-criteria",
    "clickup"
  ],
  "compatibility": {
    "universal": {
      "supported": true
    },
    "claude-code": {
      "supported": true
    },
    "pi": {
      "supported": true
    },
    "windsurf": {
      "supported": true
    }
  }
}
