{
  "$schema": "https://raw.githubusercontent.com/nanlabs/agent-toolkit/main/schemas/skill.schema.json",
  "name": "ui-ux-pro-max",
  "version": "1.0.0",
  "description": "UI/UX design intelligence. 67 styles, 96 palettes, 57 font pairings, 25 charts, 13 stacks (React, Next.js, Vue, Svelte, SwiftUI, React Native, Flutter, Tailwind, shadcn/ui).",
  "source": "npm",
  "package": "uipro-cli",
  "author": "nanlabs",
  "tags": [
    "ui",
    "ux",
    "design",
    "frontend"
  ],
  "requires": [
    "uipro"
  ],
  "compatibility": {
    "universal": {
      "supported": true
    },
    "claude-code": {
      "supported": true
    },
    "pi": {
      "supported": true
    },
    "windsurf": {
      "supported": true
    }
  }
}
